cluster/ringmaster/p100-lz-tuning
0;XgemmBatched;256;25;256;36; -DKWG=32 -DKWI=8 -DMDIMA=8 -DMDIMC=8 -DMWG=32 -DNDIMB=8 -DNDIMC=8 -DNWG=32 -DSA=1 -DSB=1 -DSTRM=0 -DSTRN=0 -DVWM=4 -DVWN=4;OpenCL: NVIDIA Corporation Tesla P100-PCIE-16GB @ 1328MHz
0;XgemmBatchedHalf;256;25;256;36; -DKWG=16 -DKWI=8 -DMDIMA=16 -DMDIMC=16 -DMWG=64 -DNDIMB=8 -DNDIMC=8 -DNWG=32 -DSA=1 -DSB=1 -DSTRM=0 -DSTRN=0 -DVWM=4 -DVWN=2;OpenCL: NVIDIA Corporation Tesla P100-PCIE-16GB @ 1328MHz
1;XgemmBatched;256;25;256;36; -DKWG=32 -DKWI=8 -DMDIMA=8 -DMDIMC=8 -DMWG=32 -DNDIMB=8 -DNDIMC=8 -DNWG=32 -DSA=1 -DSB=1 -DSTRM=0 -DSTRN=0 -DTCE=0 -DVWM=4 -DVWN=4;OpenCL: NVIDIA Corporation Tesla P100-PCIE-16GB @ 1328MHz
1;XgemmBatchedHalf;256;25;256;36; -DKWG=16 -DKWI=8 -DMDIMA=16 -DMDIMC=16 -DMWG=64 -DNDIMB=8 -DNDIMC=8 -DNWG=32 -DSA=1 -DSB=1 -DSTRM=0 -DSTRN=0 -DTCE=0 -DVWM=4 -DVWN=2;OpenCL: NVIDIA Corporation Tesla P100-PCIE-16GB @ 1328MHz
